restau_name,reviews,zip
Versailles Restaurant,I absolutely love their empanadas de espinacas (spinach empanadas) they are very delicious. I had so many of them. Their Cuban food is also incredibly...,33135
Versailles Restaurant,"I had heard from a few UBER drivers that this was the go-to restaurant in Miami and was a must try. My experience here definitely did not disappoint,...",33135
Versailles Restaurant,"Love the brunch
Every Sunday until 11:00am
Cheap/good/fresh! Oh, and it includes café con leche and Cuban toast.",33135
Sweet Dogs,"Alright to keep simple.
1.) Good Food
2.) They offer amazing popcorn 
3.) Buy the popcorn
The place has great scenery and the people who work there know how...",33134
Sweet Dogs,"Super friendly staff. It's in the most random plaza on 8th street.
The hot dog menu is based on sports teams;
I had the ""The Dolphins Hot dog"" which has...",33134
Sweet Dogs,"Best Hot Dogs in city.:)))
I love their hot dogs!
Service was very good, friendly staff)))
Very big selections of toppings on hot dog.",33134
Kush,"ok, ok I believe the hype now! 

Went to Kush last night after the HEAT game for a late night bite. We waited about 20 minutes for a table outside, which...",33127
Kush,"Great burgers! Highly recommend coming early before the dinner rushes.

Parking
There's a lot right across the street by the railroad. There weren't any...",33127
Kush,Great burger! I choose the Frita burger which was recommended by a bunch of people. The guava on it definitely added a touch of sweetness to it. The beer...,33127
CVI.CHE 105,"My favorite ceviche spot, hands down. I've been here tons of times and I've always had delicious meals, great drinks, and 5 star service. 
I've had their...",33132
CVI.CHE 105,My wife and I went here following the Mercedes Benz Corporate Run to have dinner and kill a few hours until the traffic subsided.  I've been here a few...,33132
CVI.CHE 105,"I was in Miami (Brickell) for 2 weeks for work and I went to this place 4 times.  I couldn't help it, the food here was just really good.

My go-to's were...",33132
CRUST,"It's been almost three years since I first started came to a new hidden away Italian restaurant by the Miami River. That first dinner was a formal sit down,...",33128
CRUST,"Best service in all Miami, personally my favorite restaurant.

TOP Dishes:
Seafood Risotto and Lasagna.

Just awesome!",33128
CRUST,"My family and I love Crust. This is our go-to pizza/Italian restaurant in the downtown area. This family owned eatery is friendly, delicious, and have...",33128
WHISK Gourmet Food & Catering,"​Oh boy, what a great idea it was to have my brunch UYE in here with my friends.

I called a week before to make reservations and they treated very nice....",33143
WHISK Gourmet Food & Catering,Food is very good!  Parking can be a pain in the butt. No reservations and they are very busy. The only seat when all party is on premise. They have a nice...,33143
WHISK Gourmet Food & Catering,"I had a craving for fried chicken and Whisk was the first place that came to mind.

The restaurant is not huge so be aware there can be a wait and trouble...",33143
SUGARCANE Raw Bar Grill,"Great place!  Have been there for brunch and dinner.  Brunch was good, all small plates.  It's not a cheap place, but the drinks were good and it's got a...",33137
SUGARCANE Raw Bar Grill,Another 5 star experience. Happy hour is perfect time to try out many things on a budget! Highly recommend! I put the happy hour menus in the pictures!...,33137
SUGARCANE Raw Bar Grill,Love this trendy spot!!! We sat outside when we came and it was a cool Miami night. Service was great. They have tapas which just means small plates to...,33137
Bombay Darbar,"My boyfriend and I had dinner there last night 
Everything was absolutely delicious.
Service was excellent. The night was made very
Special by the whole...",33133
Bombay Darbar,We were late for our 830 reservation and they still went above and beyond to seat us quickly.  We were here to celebrate a friend's bachelorette weekend....,33133
Bombay Darbar,"I dream about this place. Whisper ""Bombay Darbar"" in my ear, and my mouth waters like Pavlov's dog. 

Been years since my last review, so here's an update....",33133
Fratelli Milano,I came here for a work lunch and I was told before that their pasta filled with Pear and Gorgonzola cheese was really good and since that is my favorite...,33131
Fratelli Milano,"Wow, this was a five star experience from start to finish. 

We were in this neighborhood for the first time while attending the Miami Book Fair.  I checked...",33131
Fratelli Milano,"Great assortment of breads.  Delicious pear-filled pasta.  Fantastic service.  Quaint, cozy atmosphere. And one of the best, creamiest creme brûlée I've...",33131
Perricone's Marketplace & Cafe,"5 stars for everything about this restaurant!
Beautiful Rustic decorations with string lights.
The restaurant has an outdoor feel with no roof on the top...",33131
Perricone's Marketplace & Cafe,Outstanding service at this restaurant they really have a passion for ensuring all their customers are satisfied. The food is really good it's a well known...,33131
Perricone's Marketplace & Cafe,"Beware - tip adjusted!!!

Called in before arrival around 8 on a Saturday night to ask if a reservation was needed. We were seated immediately and there was...",33131
Lokal,Lokal has become one of my favorite burger places in Miami through each and every visit.  The service has always been incredibly friendly and accommodating....,33133
Lokal,"Best burgers: YES
Awesome local craft brews: DEFINITELY
Dog friendly AND a dog menu: YEP
Cool restaurant AND outdoor seating: FOR SURE 
Great staff and...",33133
Lokal,Overall Meh. This is one of those places that you really hope you're going to enjoy but completely come out of it disappointed for the following...,33133
Michael's Genuine Food & Drink,"This place is amazing. If you're not looking for it, you'll walk by. It has a beautiful outdoor seating area and ample inside space for dining. 

We were...",33137
Michael's Genuine Food & Drink,I had been planning on taking my gf for our anniversary to your restaurant and made a reservation on OpenTable for 8:15 PM on Friday night. As I'm driving...,33137
Michael's Genuine Food & Drink,"When a friend of mine said Michael's was their favorite brunch spot, I figured he was just hyping it up- he definitely wasn't! I visited for the first time...",33137
Truluck's,"Truluck's is fine dining at it's best that Miami has to offer. 

My husband made a reservation for dinner on Sunday, March 18, for my birthday. For my...",33131
Truluck's,"So, I gave this place 3 stars but really in all honesty I would probably give it 3.5 if I could ...

I ordered the surf and turf. Food tasted good but I...",33131
Truluck's,I came here primarily to try their stone stone crabs to compare them to other places I have been to. Although I did order more items- I didn't have such a...,33131
Blue Collar,"If you haven't been here yet, what are you waiting for?! The wine all the way to the mint chocolate was perfect in every way. 

I have been wanting to try...",33138
Blue Collar,"I have this friend and she's always like, we have to go here, it's amazing, she was spot on!  This is one of those places you don't want to Yelp about and...",33138
Blue Collar,"Came here after a recommendation.  

Got here pretty early. 

We ordered an app and a fish dish.   It was a bit underwhelming.  

The seating was a bit...",33138
Cardon Y El Tirano,"Delicious Food. Great atmosphere and attentive staff.

Everything on the menu looks fantastic. We tried many of the plates and were very impressed. Hidden...",33135
Cardon Y El Tirano,This restaurant had great reviews and beautiful pictures on Yelp.  When we first pulled into the parking lot I wondered if I had made the wrong choice. But...,33135
Cardon Y El Tirano,"The most unexpected hidden gem. Cardon Y El Tirano is in a strip mall on Calle Ocho, but don't let that deter you, it is incredible! 

I have seen other...",33135
Tinta y Café,"We love it all here at Tinta y Café!!!
The atmosphere, service, the food, the coffee. Ahhh, the coffee. 
They are all always so attentive, friendly. We are...",33134
Tinta y Café,"So I'm doing some power walking down Ponce de Leon  And I see this funky looking building with a crowd of people, which I find it's a little cafe.  There...",33134
Tinta y Café,"Went here today for the first time and let me just say that I really enjoyed it. The decor and vibe is amazing, it almost feels as if you've stepped into a...",33134
Zuma,"Wow, this is a must stop if you are in Miami and would like to enjoy an incredible dining experience. The space and atmosphere is really enjoyable and the...",33131
Zuma,Zuma = WOW!  Fantastic place. The tuna sashimi literally melts in your mouth and I'd highly recommend it. I have no idea how they get it to melt like that...,33131
Zuma,Where do I even begin - I visited Zuma for a work conference where we had the private back room reserved for our group. Service was top-notch - glasses were...,33131
Tacos & Tattoos,"First time at this fantastic taco shop in Kendall, will absolutely be back! We were able to get a table for 2 pretty much instantly but it was definitely...",33176
Tacos & Tattoos,"Yummm! 
I checked out this little place for Cinco de Mayo and was not disappointed. The atmosphere was really hip, and even though the location was small,...",33176
Tacos & Tattoos,"I don't know what the hype is about.  

I gathered some friends and we headed to this spot. Finally! I had it bookmarked for a while. 

Service: awesome....",33176
Greenstreet Cafe,"I came here with some friends on the last day of our trip to Miami looking for a memorable brunch and Greenstreet did not disappoint! The food was hearty,...",33133
Greenstreet Cafe,"Great atmosphere and service is always consistent. I have been here numerous times with friends, family and also alone with my dog. The food is average....",33133
Greenstreet Cafe,Had Sunday brunch at Greenstreet Cafe. While waiting for a table ordered a Strawberry Basil Lemonade to beat the heat. When seated we shared the Spinach &...,33133
specialTEA Lounge,So glad I decided to come here last night! My boyfriend and I were starving around 11 pm and through Yelp found that this coffee shop was open that I had...,33165
specialTEA Lounge,Great place to get some coffee and chat with friends! My friend from FIU recommended this place for coffee since we were in the area so I stopped by....,33165
specialTEA Lounge,"I ordered a takeout order through Yelp for a matcha blended drink, a caramel latte & a double chocolate chip cookie. This place had so many good reviews and...",33165
Osteria Vecchio Piemonte,"I've been dying to come to this restaurant for month. 
Oh my god! Words cannot describe the joy my palate experienced. By far the best hidden Italian jewel...",33173
Osteria Vecchio Piemonte,"Nice little hole in the wall. The food is great and the service is also five star.

We will definitely come back. Let's see how good the service is when I...",33173
Osteria Vecchio Piemonte,"After an extensive research for restaurants to celebrate my birthday, decided to stay around the neighborhood and go to Osteria. I've had this restaurant...",33173
Doce Provisions,I stopped by Doce on a Sunday afternoon and was extremely satisfied with the food and service. It was nice out so we decided to sit outside and thankfully...,33130
Doce Provisions,"Great spot to go and share plates! A lot of good things on the menu

My favorite is the short rib tacos and the shrimp po boy tacos! 

La Rubia on draft is...",33130
Doce Provisions,"Food wasn't as great as other reviewers had mentioned - perhaps I came on an off day, there seems to be a quality control issue.

Crispy Brussels - Took a...",33130
KYU,"It's such a happening spot in this artsy Wynwood District. Fairly new, just opened in November 2017, you need a reservation for weekend or even week night....",33127
KYU,"This place is delicious! The rice that comes on a stone it's beyond good... you have to try it! 

Service is ok... a little slow sometimes. If you are...",33127
KYU,"We visited KYU on a Saturday night with no reservation, and not expecting to get one, but we figured why not let's try. We were able to put in our name and...",33127
Lagniappe,"I absolutely loooved this place! We came on a really crowded Saturday night and had a great time. The backyard area is huuuuge and definitely fills up. 
The...",33137
Lagniappe,"Although I love the concept, and the jazz bands that play here, I think they could keep this place much cleaner and organized. There are lots of chairs in...",33137
Lagniappe,"This is a really nice spot I frequently came to when I was still living in design district.
They have amazing live bands. Like, Where else in Miami would I...",33137
Beaker & Gray,"Hmm where should I start?..
A friend of mine recommended this place so I decided to give it a shot.
Wasn't really hungry, it was around 11pm and just felt...",33127
Beaker & Gray,"I've come for brunch here twice now and have had great experiences. The first time, our waitress was Julisse and she was so great. She gave us a rundown of...",33127
Beaker & Gray,"$7 top shelf cocktails, $5 craft beers, wonderful and friendly staff

Ambiance galore with an eclectic and diverse food menu

Looking forward to a second trip",33127
Fireman Derek's Bake Shop & Cafe,I must preface that I am not a fan of sweets. There are few exceptions and Key Lime Pie is one of them. Being that my wife and I were traveling through...,33127
Fireman Derek's Bake Shop & Cafe,"Very very very good first experience here at Fireman Derek's. 
As soon as I walked in I realized how cute of a place it was. It looked just like a...",33127
Fireman Derek's Bake Shop & Cafe,"I knew I had I had to search for some great dessert in Miami and this place is one of the hot spots. Aside from the donuts, I had to get my hands on some...",33127
Lung Yai Thai Tapas,"The food was EXCELLENT! The staff was FABULOUS! 

It's worth the drive and if you get there late the wait!

I strongly recommend eating here",33135
Lung Yai Thai Tapas,The BEST Thai Restaurant in town. Extremely authentic and flavorful plates. Heed the warning and try to make it here early as this place really gets...,33135
Lung Yai Thai Tapas,"My boyfriend and I split the dumplings- bomb. I had the green curry- delicious. We got in super quick, service was great. The place smelled kind of foul,...",33135
Doggi's Arepa Bar,"BEST AREPAS in Miami! I'm a regular here. As a matter of fact, it's hard for me to stay away and have to limit my visits. I've tried most of the menu by now...",33145
Doggi's Arepa Bar,Came here pretty early for breakfast and that was our mistake. The food was good but it was way too heavy for us to consume for breakfast. I'd likely come...,33145
Doggi's Arepa Bar,"Not going to lie, I was not that excited when my friends wanted to eat here, but I ate my words and negative feelings real quick. My friend told me they had...",33145
Mandolin Aegean Bistro,"Staff very attentive and food really good.
If you get there around 7pm there's a chance for a quick table even if you don't have a reservation, although I...",33137
Mandolin Aegean Bistro,"Love this place. Great ambiance and delicious food. Spicy lamb sandwich on the lunch menu- amazing. 

Do you prefer the expression spaghetti and meatball?",33137
Mandolin Aegean Bistro,"How did I not know about this place earlier! What a gem.

First of all, the Ambience....SO romantic if you sit outside. Unfortunately we were a walk in, so...",33137
Fratellino,"It took me a while to write this review but here it is: 

You haaaave to visit Fratellino at LEAST once in your lifetime.
Where do I start? The service was...",33134
Fratellino,"My husband and I chose this place to celebrate our wedding anniversary after reading all the outstanding reviews on Yelp. Well, we loved the experience so...",33134
Fratellino,"Fratellino has ruined me, because now I only want to eat there.

I'm a carboholic. The best meal in the word, to me, would contain carbs. But, my body loves...",33134
The Spillover,This is the cutest insta-worthy restaurant in Coco Walk with their catchy entrance quote and neon sign exit. It's got beautiful outside seating beside the...,33133
The Spillover,"Well.... what can I say 

This place is for people that either where EX hippies or just came from rehab as previous bums. 

 About the food, it's was OK....",33133
The Spillover,"Amazing.... simply amazing.
Always a good time when I go. The atmosphere is always relaxing and the food is always superb.
Always try to get there early so...",33133
Roots Juicebar,"*Story Time* 
It's Saturday. You finished the dreaded Pilates class your friend has been trying to drag you to since January (new year, same me?). You're...",33183
Roots Juicebar,"Overrated and bland. My friend and I came here yesterday, I had the fajita bowl and she had the lentil bowl. The wild rice was a bit dry, the mushrooms were...",33183
Roots Juicebar,"Whenever I'm in town, I like to come here! The atmosphere is really cute with greenery, books and cute decor. They have outdoor seating as well as indoor...",33183
Red Carpet Italian,AMAZING little gem! Casual-ly but 5 star food. My dad and I were in town shopping and being Italian he was craving... get this... Italian  searched yelp and...,33135
Red Carpet Italian,Hidden little Gem in the heart of Little Havana. My Boyfriend and I visited this restaurant over the weekend for dinner. We made reservations for 2 on yelp...,33135
Red Carpet Italian,My daughter ate here last week and we decided on her recomendación to make it the place for our Easter lunch. If you look through my reviews you will find...,33135
Toro Toro Restaurant,"This was my first time at Toro Toro and I absolutely enjoyed everything I tried there. For appetizers, I got the Grilled Octopus and it was the best octopus...",33131
Toro Toro Restaurant,OMG what an amazing experience. We came for the Saturday Mexican buffet special. Now don't get me wrong I'm NOT a fan of buffet...but the ToroToro Saturday...,33131
Toro Toro Restaurant,"This is one of the very few times I have felt that 5 stars are not adequate enough to describe such an extraordinary restaurant, so I will rate them at a...",33131
La Camaronera Seafood Joint & Fish Market,"I saw a clip of this restaurant on one of the food channels. I saw it was pretty close to my barbershop so I told my self, ""Let me go get a haircut, and get...",33135
La Camaronera Seafood Joint & Fish Market,"Excellent...good food, casual ambiance, great service. Had been meaning to come here for months and finally did when I dropped off my car to get washed...",33135
La Camaronera Seafood Joint & Fish Market,La Camaronera Seafood Joint & Fish Market is one of those signature Miami hole-in-the-wall restaurants off of West Flagler Street that you just can't help...,33135
Vegan & Juice,Who knew vegan food could be so yummy? With generous portion sizes for only $8 you can get 1 meal that will last you for lunch and dinner. Better than any...,33174
Vegan & Juice,I am in no way a vegan but if all vegan food tasted like this I could be. This place is so bomb. I decided to try it because it is close to my job and the...,33174
Vegan & Juice,"What's not to love about this place!? It's run by a very nice Dominican family so you know the food is bomb. Everything from their juices, smoothies, wraps,...",33174
Jaguar Ceviche Spoon Bar,"Jaguar has a very intimate setting inside. A lot of dim lighting, and exotic/tropical decor. My boyfriend and I dined in for dinner last night and we loved...",33133
Jaguar Ceviche Spoon Bar,"It's extremely rare that I give 5 stars however this place was worth it. The servers were very friendly, the menu wasn't over loaded but still gave you...",33133
Jaguar Ceviche Spoon Bar,"Solid Pan-Latin restaurant in Coconut Grove.  They don't necessarily have an extensive menu, but their food is pretty flavorful.

The highlight of the...",33133
Mignonette,We arrived late with no reservation. Concerned that the staff would be upset at our arrival we asked if it was still ok to sit at the bar. We were welcomed...,33132
Mignonette,I've wanted to try this place for a while now. I know that they are known for their oysters though I unfortunately did not get the chance to try their...,33132
Mignonette,"We had such a delightful dinner here during our baby free weekend getaway. I'm glad we made reservations because it was very busy on a Saturday, in an odd...",33132
Bunbury,"This was our first dinner in Miami, and I'm so happy that one of my clients recommended this place to me. Stunning atmosphere, very fitting of Wynwood. I...",33137
Bunbury,Came a few weeks ago on a Saturday evening. We made reservations after reading many reviews. They open at 7pm and we were one of the first few people there...,33137
Bunbury,"What an amazing experience from top to bottom!! *Insert drooly, heart eyes emojis*

The ambiance is very sexy. Dimly lit, with just the sounds of indistinct...",33137
Vero,"Loved this place! Great romantic Italian restaurant in Downtown Miami! 

I came here the other night on a date and we had an amazing time. 
We ordered the...",33131
Vero,"Good food, great service, and reasonable prices.

I came here during my visit to Miami and as a good Yelper, obviously I wanted to try something local My...",33131
Vero,Stopped by after the Miami Street Photography Festival at the HistoryMiami Museum a few blocks away. This is truly a gem in downtown Miami and close to make...,33131
El Palacio De Los Jugos,"From all the choices, the portions, the service, everything was soooooo good! 
We had Lechon Asado with congri, and plantains.... yummyyyyyyy 
Also the...",33144
El Palacio De Los Jugos,"My first stop EVERY TIME I head to FL to see my kid.  Their juices are beyond amazing - my favorite is the mora (blackberry) - if sweet, rich blackberry jam...",33144
El Palacio De Los Jugos,"If you want to experience the flavors of Miami in one stop, look no further than El Palacio De Los Jugos.

Yes, they were widely renowned for their...",33144
Pizza Johny's,"Walked into the place and thought I was in Brooklyn!
From the Pizza guy tossing a large pie over his head
to the yells of ""Hello"" and ""How ya Doing"" from...",33173
Pizza Johny's,Was in Kendall and decided to branch out from the usual spots I get pizza from in that area.  Good old Yelp gave me some good feedback about this place to...,33173
Pizza Johny's,"This place is awesome, Johnny himself attends to you and treats his customers and staff  like family. 

Their chicken wings are AMAZING, and their NY style...",33173
SuViche - Wynwood,"Best happy hour in Miami.
We came and we ate everything!
Every single dish we had was incredible!
$4 Sake, $5 mixed drinks and $6 dishes of amazing Peruvian...",33127
SuViche - Wynwood,"This just became one of my favorite spots for a ceviche bowl. Its really tough to get portion size, flavor, AND price point all in one place. SuViche does...",33127
SuViche - Wynwood,You're better off finding another restaurant in Wynwood. SuViche did not leave any impression on me whatsoever. I dined here for a friend's birthday party...,33127
Mojo Donuts & Fried Chicken,"Where do I start? 

Ummmm delicious! 

The minute I walk in I go straight for the Oreo Glazed Donut. The fluffiness of the doughnut just melts in my mouth!...",33165
Mojo Donuts & Fried Chicken,"Hands down best donuts I had in a while 
Delish!!!
This place will become a problem for my waistline",33165
Mojo Donuts & Fried Chicken,"Its hard not to see all sorts of beautiful and tempting donuts when you go on Instagram and happen to like one donut picture, lol!

But, it seems I am never...",33165
NIU Kitchen,"One of the best and most generous grilled whole squid servings I've ever had. 

Friendly staff, quaint setting, nice for an intimate date to flavor town.",33132
NIU Kitchen,"Enjoyed a delicious meal at NIU Kitchen on Thursday evening. Ordered a nice bottle of Spanish wine to go with our meal of Llamantol, Steak Tartare,...",33132
NIU Kitchen,"Tiny, but cozy. Dark, but intimate. Small menu, but delicious. Interesting decor, esp the books on the ceiling. Staff was great and accommodating for our...",33132
Mi Rinconcito Mexicano,"Great place! The kitchen pumps out food at the speed of light.

I was seated right away and given their salsa chips. The hips are fried on site and they're...",33135
Mi Rinconcito Mexicano,"Ay mi rinconcito mexicano! I will rate this place a 10 *star*! 

I got introduced to this hidden little place by Little Havana. I came with some colleagues...",33135
Mi Rinconcito Mexicano,"Great authentic Mexican food, nicely decorated restaurant I love the piñatas hanging all over, the marichis hats.
Notice that this is not a fancy place but...",33135
Peacock Garden Cafe,Tucked away in a lush garden is this picturesque and charming cafe. We visited on a Saturday around 10am for breakfast and it was quiet -- only one other...,33133
Peacock Garden Cafe,"The captain of the bay cruise we chartered recommended we eat here after our sunset cruise. Seeing so many positive reviews, it seemed like a safe bet. I...",33133
Peacock Garden Cafe,Spring break staycation had begun for us teachers and counselor (me) came for brunch and was sad that they only serve brunch on weekends- no biggie will...,33133
The Capital Grille,"Definitely this a date or celebration of a special event place. The costumers are dressed upscale which matches the place, it's ambiance, and everyone...",33131
The Capital Grille,"Anniversary diner . Can't go wrong . Good food, service and ambiance . 
Nice touch of a rose and anniversary card at the table waiting for us !
Anna got the...",33131
