restau_name,reviews,zip
Lil Greenhouse Grill,"The collard greens were amazing! Great place for soul food and will return. It's near Jackson's and between the two, I would choose Lil Greenhouse any day....",33136
El Porton de la Flaca,"Amazing food, atmosphere, etc. Found this little gem randomly since I was in the area, and SO glad I did! The food was perfect and authentic!",33172
El Porton de la Flaca,I was around the area. And was not sure on what to eat. This place had great reviews here on yelp. I decided to give it a try since I love colombian...,33172
El Porton de la Flaca,"This place is amazing. It's true it's a hidden gem, The food is great, the service is wonderful. Alba snd la Flaca really know how to do it. The bEST...",33172
Pincho Factory,My husband and I went on a weekend trip to Miami in the middle of doing Whole 30 (what were we thinking) and this place made the most sense to get the food...,33174
Pincho Factory,This is the location closest to my job so it makes it easy to get to regularly. The food never disappoints so I'm glad that's consistent at every location....,33174
Pincho Factory,"Some serious mismanagement is happening here. The staff are friendly, the food is decent, but they obviously don't restock often enough. I tried getting a...",33174
Harvest Moon Gourmet Bistro,"Nice go to spot 
They have great tuna and turkey melts served on pita bread and lots of cheese.
My moms favorite juice is the pina colada super sweet and...",33166
Harvest Moon Gourmet Bistro,"You can't go wrong with harvest moon. Located in the beautiful, very special Miami Springs! This place is GREAT for a savory healthy meal. They always have...",33166
Harvest Moon Gourmet Bistro,"Miami Springs has many gems and this one was very cute.  It's a tiny place that used to be a gas station.  You order up in the front, they only accept cash,...",33166
Palat Miami,"This restaurant took me by surprise. I wasn't  expecting to be blown away by their dishes, but I was. This restaurant serves Italian Tapa style dishes  with...",33137
Palat Miami,"I'll give 5 stars to this new restaurant in Design District even when I found portions a little small.

I went to Palat with a friend on a Friday night,...",33137
Palat Miami,"Needing to pivot happy hour plans, ended up finding Palat Miami. Took advantage of a fantastic happy hour by enjoying several of the wine selections as well...",33137
Moe'z Express,Had a hankering for something sweet so a friend of mine stopped in late night to try their fried Oreos which were delicious! They came with plenty and we...,33174
Moe'z Express,"My 2 stars is simply about the service my coworker and I received when we came for lunch. My coworker placed his order, paid, and received his receipt and...",33174
Moe'z Express,First time coming here after hearing so much hype about it but can't say I'll be returning. I ordered the chicken quesadilla and the big red hot dog for my...,33174
Pisco Y Nazca,Went here for dinner this evening in the heart of midtown Doral. It was pretty busy at 7:00pm on a Wednesday evening. I Iike how they have the restaurant...,33166
Pisco Y Nazca,"I dropped by the Kendall restaurant location for a smart lunch a couple months ago ... So, when I sat down here in the Doral-based Pisco y Nazca for the...",33166
Pisco Y Nazca,"I just love this place, from location to customer service, the food was spot on, we went for lunch for my friend birthday.
The papas huancainas appetizer...",33166
Latin American Bakery & Cafe,If you're a guava and cheese lover then you must try their guava and cheese croquetas. O.M.G! They're so good one is not enough. I like how they have the...,33144
Latin American Bakery & Cafe,"Good food this side of Versalles...
The Crema de Malanga is to die for!
The staff is friendly, and if you just want a cafe, well you can sit at the counter.",33144
Latin American Bakery & Cafe,I like to consider this spot the WeMi non-touristy version of Versailles. Everyone loves Cuban diners and their matching bakeries but this place is more...,33144
Hibachi Grill & Noodle Bar,"Thanks to PostMates for my new lunch obsession. Honestly we order once if not twice a week and it's been consistently amazing. 

We've order teriyaki...",33132
Hibachi Grill & Noodle Bar,"I'm going to preface this saying that the food is amazing. 5/5 stars for the food. However, my experience when eating at this establishment has moved me to...",33132
Hibachi Grill & Noodle Bar,While the food here is excellent. The portions are ridiculously small for the price. They need to fix one of the two. The second gripe is the abysmal...,33132
Doc B's Fresh Kitchen,"TLDR -  Same old restaurant formula, great new culinary tricks

Doc B's offers the same, familiar atmosphere of a fun, modern restaurant serving American...",33134
Doc B's Fresh Kitchen,"Wow! Such great service, fast seating in what seemed to be a busy lunch. The hostess even brought my beer out for me before the server got here. Our server,...",33134
Doc B's Fresh Kitchen,"Living in Coral Gables for the past five years, I'm pretty familiar with about 80% of the restaurants in the area. This new addition is not only a breath of...",33134
Sergio's Restaurant,I came to Sergio's for lunch with the sole purpose of just trying their croquetas for my food instagram and ended up ordering a meal since I was so hungry...,33176
Sergio's Restaurant,"Like all the Sergio's locations, this place offers delicious and consistent comfort food. The go-to location for Cecilia and I, we specifically request for...",33176
Sergio's Restaurant,"Originally from Miami and whenever I am in the area, I have to indulge in some lovely, local Cuban favorites.  

I ordered a few dishes to my hotel room and...",33176
Manhattan Chicago Pizza Kendall,Decide to take my parents who lived in Chicago for 35 years to this tiny Pizza restaurant to try to taste a true Deep dish Pizza. To our surprise that this...,33176
Manhattan Chicago Pizza Kendall,"Found this little jem online. It was a little hard to find the restaurant since its located on the side of the building.
 They serve authentic New York and...",33176
Manhattan Chicago Pizza Kendall,Had a family dinner today to celebrate my son's 21st birthday today. I had called ahead just to make sure they can accommodate a party of 8 so they reserved...,33176
El Pub,Oh El Pub. You consistent light at the end of a tipsy tunnel. What more is there to say than media noches after a few rounds at Ball & Chain? I can't...,33135
El Pub,"The Big Bus Tours of Miami bought us to Little Havana in Shenandoah, Miami. The journey took an hour and we were starving when we got off the bus. We were...",33135
El Pub,"Went here for lunch as part of a walking tour.  Enjoyed the midnight sandwich and fried pork chunks - both were delicious and generous in size. 

The...",33135
Ghee Indian Kitchen,"As per custom for restaurants in the Design District/Wynwood Area, Ghee is a ""modern take"", but this time it's Indian food.  And, frankly, the food here is...",33137
Ghee Indian Kitchen,"You just can't lose by picking Ghee Indian Kitchen for dinner. The price can't be beat, the tastes are on point, the service is attentive and everything is...",33137
Ghee Indian Kitchen,"Great place good food. Good service. Modern take on Indian. Really fresh and tasty!

Lots of vegan options love that. Super fresh spices you can really...",33137
Tacocraft Taqueria & Tequila Bar,We enjoyed taco craft for a nice Friday afternoon lunch. We sat outside under the umbrellas. The restaurant sits in the heart of a booming South Miami. The...,33143
Tacocraft Taqueria & Tequila Bar,"My wife had an opportunity to check this place out a few months ago with her friends, she enjoyed it and shared that if I have a love for Mexican food then...",33143
Tacocraft Taqueria & Tequila Bar,"I been here twice, so I think I have enough experience for this review. This place is certainly different and I love the painting on the walls. It give you...",33143
Taste Buds of India,I'm so glad I came today to sample their lunch buffet with my two friends. Their lunch buffet is $16/per person and I felt this was a very appropriate price...,33143
Taste Buds of India,"Love the authenticity of this restaurant! We have been visiting Taste Buds of India for a while now, and I must say that we have never once been...",33143
Taste Buds of India,"Food was good.  They have a lunch buffet which made it easier for us because we have 1 hour for lunch. The buffet has a good variety including chicken,...",33143
Jr's Gourmet Burgers,I have to be honest----I was a little skeptical before coming in because I had heard so much hype about these burgers from all over but when I finally got...,33166
Jr's Gourmet Burgers,So I came to this place after seeing it on the travel channel. This place was amazing sort of built like a hole in the wall but wasn't really a hole in the...,33166
Jr's Gourmet Burgers,"*Had lunch here the other day. Updated rating. Five stars. *

This place is the only burger place in the area.

PROS
-Good burgers, tasty and filling; out...",33166
MAO Colombian Fast Food,Mao is just a hole in the wall restaurant with some DELICIOUS and huge Colombian burgers. When you come here just get a Super Hamurgesa and let the cooks go...,33155
MAO Colombian Fast Food,"My first exposure to Colombian Street Food rocked.  While this place is a hole in the wall and quite grimy, that is one of the unique identifiers of really...",33155
MAO Colombian Fast Food,The best Colombian street food in Miami hands down! I ordered the maicitos and was left in a state of euphoria finding it hard to remember what day of the...,33155
East Side Pizza,Ordered delivery from there the other day. The pizza was delicious. Very well made!! The delivery was on time even though it takes them a long time to...,33138
East Side Pizza,"Pizza taste worse than card board
And ketchup. Black female employee
Was very unfriendly and rude and poorly
Dressed of her uniform.
Pizza place has...",33138
East Side Pizza,"This place is Hit or Miss!
When we dine during the day the food is really great. I really enjoy the food when it is prepared correctly; however, after...",33138
Bru's Room Sports Grill,"Great place to watch a game! 

Definitely, enjoy coming to Bru's Room to watch a game and hang out with friends. Great location which was lacking a sports...",33155
Bru's Room Sports Grill,Five of us went for an early lunch. We arrived at 11:27 but noted that they did not open until 11:30. The bartender told us we could seat ourselves but that...,33155
Bru's Room Sports Grill,Walked in on a Saturday afternoon and was seated right away because there were plenty of available tables. There was a table next to me with about 8 people...,33155
Crazy Poke,Hands down the best poke bowl I've had yet! Tucked away in Wynwood this poke shop fits in perfectly with this neighborhood. The spicy tuna poke is packed...,33127
Crazy Poke,"Had lunch at Crazy Poke on Sunday afternoon. Ordered a large Build Your Own Bowl with Spicy Tuna and Salmon.

Quality
What better time than Yelp Restaurant...",33127
Crazy Poke,"I was on the hunt for a good poke bowl for lunch while I was in the Wynwood area, and stumbled across Crazy Poke. It's a nice casual spot with plenty of...",33127
El Rinconcito Latino,"I come here at least once a week, normally on the weekend with my toddler, and I have been happy every single time. It's almost always busy, but not so busy...",33155
El Rinconcito Latino,"I came from breakfast and didn't have much, so I wasn't sure if I should leave a review for cortadito, tostada and a croqueta. Everyone Cuban, that I know,...",33155
El Rinconcito Latino,"Abuelo Hugo's doctor is Cuban and he considers himself somewhat of a ""Cuban food snob."" He highly recommended this low-key locals' spot for grabbing...",33155
Shibui,I love Shibui! Hands down my favorite Japanese restaurant in town! I've been here many times throughout the years and I can definitely recommend just about...,33173
Shibui,I've been coming to Shibui for a long time and this restaurant hasn't failed me yet. I even post mated a massive order that was delivered to my house...,33173
Shibui,Is there a place that was in your regular rotation and then somehow you forgot about it? For me that's Shibui. We came here regularly for Sushi in the 90s...,33173
Para Dos,We visited Para Dos on a gorgeous Miami Saturday afternoon.  We were celebrating my parent's 56 Wedding Anniversary and wanted to take them to an intimate...,33134
Para Dos,"The ceviche was Top Notch 4 starts just for the ceviche. The lomo saltado was good but a small portion for the price.


Our waitress was very nice and...",33134
Para Dos,"I saw the sign of the lunch special which was a chicken wrap with salad or fries for $8.

I walked in and immediately the smell of gas hit me. I was just...",33134
Gaetano's Pizzeria,"Perfeect pizza. I walk here from work and opt for the everyday special.. 2 slices and a soda- it's heaven.. real thin crust, nice and crispy. Not overly...",33156
Gaetano's Pizzeria,"Pepperoni pizza was hot and waiting when I arrived for pick up. I'm going to rate at 4 stars, with the benefit of the doubt for personal taste. I did not...",33156
Gaetano's Pizzeria,Amazing Taste for a great price! Staff is friendly and makes it a pleasure to eat at their location. Five Stars!!!!,33156
Sushi Maki,"We were SHOCKED at the quality and variety of menu items at Sushi Maki. I mean, it is in an airport. It was wonderful!. We love sushi and thai food and...",33126
Sushi Maki,Found this place while walking towards an airport lounge in Miami international airport. Decided to give it a try due to the long layover we had. Boy was it...,33126
Sushi Maki,"Relatively exorbitant pricing, rubbery noodles, butchered pieces of god-knows-how-old fish, overly-sweet drinks, flash frozen chicken, sugar in EVERYTHING,...",33126
La Carreta,So happy we decided to give La Carreta a try. The parking lot was full and we almost left before going inside. We were seated quickly and service was fast...,33172
La Carreta,"This is not as delicious as Havana Rumba back home in Louisville, Kentucky but good nonetheless. 
I ordered the Surtido De Croquetas which is a variety...",33172
La Carreta,"Usually we have Breakfast Brunch at this location but it have been a while, long while.
      We arrive at 8 on the morning & door was close, waited for a...",33172
Groovy's Pizza & Grill,"The crust of the pizza here is my absolute favorite. I can't explain it but there is a certain hint of a sweetness to it, like sprinkle nutmeg. 
You can't...",33133
Groovy's Pizza & Grill,I used to be a fan of Groovy's Pizza & Grill but lately the service has gone down and the professionalism from the employees that work there is very poor....,33133
Groovy's Pizza & Grill,Perfect location and perfect hours of operation. I live in the Coconut Grove area and was up in the wee hours of the night. Made a late night stop here for...,33133
Chevys Fresh Mex,"Best fajitas in town the service was fabulous and the manager is. on top of things if you want great food and great service you come here
Great Margarito's...",33126
Chevys Fresh Mex,"Family night out everything going well until until a roach came across the floor not good can say nothing else about this


After all set and done and...",33126
Chevys Fresh Mex,"First time at this restaurant and I was excited because they're supposed to be very vegan friendly.

I ordered a burrito and made sure to say it was vegan...",33126
Toasted Bagelry & Deli,Amazing bagels! The sandwiches are packed with ingredients that the filling starts falling out from all angles. The egg sandwiches are good too. They're...,33145
Toasted Bagelry & Deli,"This is the place of worst customer service for them the customers do not matter, we asked for a breakfast and everything was wrong and worse than they...",33145
Toasted Bagelry & Deli,"I am a bagel fanatic. Especially a Nova Lox, Capers, Cream Cheese, on poppy bagel fiend. This place did not disappoint. The bagels were fresh and delicious....",33145
IL Bambino Cucina Italiana,I've been eating here since 1992 and everything is exceptional. The food quality has improved throughout the years,33155
IL Bambino Cucina Italiana,Ordered pasta primavera via uber eats and instead got bland pasta with zucchini and carrots only...? Not sure why they wouldn't just cancel the order if...,33155
IL Bambino Cucina Italiana,Garlic bread and their French onion soup were good. My children had spaghetti bolognes and they liked it. I ordered escargot as an appetizer and didn't like...,33155
Cadillac Ranch,Cadillac Ranch is really your typical themed American bar and grill. Not much different than ale house or tgi Fridays when it comes to the food and...,33183
Cadillac Ranch,"Ask for Damari! She's an amazing server and has great suggestions.

The food is delicious. The pork chops, ribs and crispy fish tacos are delicious.

We are...",33183
Cadillac Ranch,"I've been to CR on multiple occasions for brunch, lunch, and dinner. Each time I've left satisfied. The food is great, the menu selection is vast, and the...",33183
Gusto Fino Café,My favorite place in the Gables for lunch! Their hot sandwiches are amazing! The Marco Polo is my favorite. Their homemade barbecue sauce is delicious....,33134
Gusto Fino Café,"Grabbed lunch at Gusto Fino Cafe on Saturday afternoon. I ordered the Chicken Parmigiano Sandwich and a side of Potato Salad. 

Quality
I was looking for...",33134
Gusto Fino Café,"What a beautiful and cozy restaurant! I felt like i was home, everyone treats you so nice and the food was beyond words. The owner was more than caring and...",33134
La Lupita,"DELICIOUS. Mmm can't wait to visit again. I tried all the tacos (chicken, beef, mushroom), the chips/guac are so fresh and full of flavor, and their...",33131
La Lupita,"So this place is SUPER yummy, the food is good Mexican food but there are a few things that turn me off about it. 1. The lunch menu is a post card with a...",33131
La Lupita,"I like it here. Never crowded. Always a smiling face willing to help, and the food doesn't suck. The thing about Lupita is that their alcohol is...",33131
Moonlite Diner,Love this place very friendly staff. Food is fresh and get a lot for the money. The shakes are off the chain.,33183
Moonlite Diner,I don't like giving bad reviews. I like to be fair... I like to highlight the best parts of a business I review whether it's a restaurant or store... but...,33183
Moonlite Diner,Driving around town we needed a place to eat (party of 7 - today 1/13/18 at 4:00pm).  We decided to eat at Moonlite Diner since we wanted to do something...,33183
Le Chick,"We went thinking it was happy hour, but it wasn't. 

However the house comped the first round of drinks which made up for it! The food and service were...",33127
Le Chick,Pro tip: Le Chick DOES take reservations and you may need one! We rolled up around 7:00 pm on a Friday night and had to sit at the bar facing the kitchen....,33127
Le Chick,"Have been hearing great things about Le Chick so I stopped by for lunch. This restaurants has the coolest decor. When you walk in, you are greeted by the...",33127
El Tucán,"After seeing all their awesome pictures on social media and looking at how much fun the place looked, my friends and I decided to come here for a friend's...",33130
El Tucán,"we initially had reservations for a Saturday night. They called us and informed us that they'd have to accommodate us for Friday night, because they had a...",33130
El Tucán,Great entertainment. Loved the atmosphere BUT worst service in South Miami if you're not a large group 6 or more don't go.  It's a Dinner Show we were a...,33130
Sokai Sushi Bar,"First timer at sokai and honestly it was super delicious. 
It's a Peruvian sushi fusion place so do NOT expect traditional Japanese rolls. These rolls have...",33172
Sokai Sushi Bar,"This was my first time at Sokai even though I'm in the area fairly often, but I have to be honest... I was not impressed.

They were obviously not prepared...",33172
Sokai Sushi Bar,I had reservations and once we sat I waited patiently over 1 hour until I noticed that the tables around us who had sat after where getting their food. When...,33172
Café Pastis,I love this Restaurant... it is my favorite French food restaurant in Miami. Owner is always at the Restaurant and this place runs smoothly... the staff is...,33143
Café Pastis,My husband and I love French cuisine so for brunch recently we wanted to eat at a cute little brasserie. Too bad our private jet was being repainted so we...,33143
Café Pastis,Best French food ever. My son had escargot and was amazed. Then he had grilled salmon and was equally amazed. I had pate followed by the duck with green...,33143
La Taberna Giralda,"A gem that I wish I found sooner! 

We stumbled upon La Taberna after attending the Coral Gables Art Festival. It was empty but we love authentic Spanish...",33134
La Taberna Giralda,"came for a party. restaurant was full to capacity yet only 2 servers.the chick pea sausage was bland.  the veggi paella was drie.

the music is LOUD",33134
La Taberna Giralda,"I'm not a big fan of tapas but La Taberna Giralda changed my mind. I visited on a Friday in hoped to listen to the band, but when we got there I was advised...",33134
YUZU Frozen Yogurt and Crêpes,I recently visited this froyo spot after 4 years. My first review was not a good one but I figured let's give it another shot. I'm really glad I did! Maybe...,33130
YUZU Frozen Yogurt and Crêpes,"Great variety of flavors and toppings on a serve your self setting. They also sell Crêpes, but I have not tried those. Prices are average for a fro-to...",33130
YUZU Frozen Yogurt and Crêpes,"If you are in the Brickell area you should go to this place! They have great French crepes and Frozen Yogurt, my favorite is the Taro, AMAZING!",33130
Chifa Du Kang Chinese Peruvian Restaurant,Peruvian living in Miami for 17 years and this is the closest you'll get to authentic Peruvian Chinese cuisine. I've probably tried everything on their menu...,33165
Chifa Du Kang Chinese Peruvian Restaurant,It took one hour and 20 minutes to make it from Palm Beach to this location. The outside was not appealing small corner location in a busy plaza. But as...,33165
Chifa Du Kang Chinese Peruvian Restaurant,"Chifa is a Peruvian Chinese fusion, which is very popular in Lima, however this restaurant is one of the two authentic chifa that can be found in Miami. We...",33165
Kiki On The River,"We went group of 6 for birthday party,
The service was great the food is perfect the place is amazing and I can keep talking more and
More, super recommended.",33128
Kiki On The River,"Skip it, unless you want a show.  We had a reservation for dinner for eight people.  

1.  Even with a reservation they act like it's a club, so they have...",33128
Kiki On The River,"Worst experience ever, from arriving, to not being seated properly, to having to wait over an hour for everyone to receive their food, to an unhelpful...",33128
Cantina Grill,"This place was great. Massive, I mean MASSIVE, portions for a great price. Only giving four rather than five because the salsa at the salsa bar did not...",33176
Cantina Grill,"Ive loved this chain for years but I've noticed this location has not been using fresh ingredients lately. It's a shame, the workers seem nice.",33176
Cantina Grill,"Been a customer for the last 2 years, going at-least once if not twice a week. Food has never disappointed. But new employee(s) have been hired and the...",33176
Bugatti Restaurant,"The gables was once a bastion of French and fine continental dining with places like the the French Connection, Charade and Le Festival dominating the...",33134
Bugatti Restaurant,"I have only been to Bugatti on one specific day of the week. That day, is Wednesday. And I have only been to Bugatti one specific time of the month, the...",33134
Bugatti Restaurant,"Lasagna is absolutely amazing! I really love this place and have never had a bad experience. Service is always on point and food is always hot, delish and...",33134
St. Roch Market,"St. Roch Market is at Palm Court in Design District on the second floor.
Parking is available in the street (limited), valet or in the building ($3 for the...",33137
St. Roch Market,"St. Roch Market, inspired by the one in New Orleans, is one of the newest Miami food halls that just recently opened and it's located inside of the Design...",33137
St. Roch Market,"Located in the design district, second floor by the water fountain and giant bubble and blue glass walls! It's a great place to come to grab a meal with...",33137
Sergio's Restaurant,Not sure how I have lived so close to this place my whole life and only recently tried it! This place is the bomb for a quick delicious Cuban meal. The...,33165
Sergio's Restaurant,"Eh. 

How does a Cuban restaurant not have avocado? I mean I was starving but the sandwich wasn't all that. My prima ordered the chicken salad sandwich with...",33165
Sergio's Restaurant,"Great breakfast place, they serve breakfast all day for a $1.50 extra if you miss their morning hours. The pan con tortilla was delicious. The ""South Beach""...",33165
Caribe Cafe Restaurant,We went here specifically to enjoy their wide selection of Ceviche offerings and we were not disappointed. It was AMAZING!!!!!!!,33144
Caribe Cafe Restaurant,I visited the outside bakery. This is a small restaurant in a plaza. The area is OK. - The Restaurant is very visible when you're driving down...,33144
Caribe Cafe Restaurant,I've ordered delivery several times from this location and have never had an issue. Super fast delivery and the food was always hot. This morning I stop by...,33144
