restau_name,reviews,zip
Arbetter's Hot Dogs,"All Around w/ cheese, Cheese fry side, drop 2 corns, with a Sm. Coke

Dip your corn dog in the cheese then ketchup then eat it.. Magic in your mouth

Larry...",33165
Arbetter's Hot Dogs,"Born and raised in Chicago, you know I know all about hot dogs. There's nothing like a Chicago Dog or Chicago Red: prepared and topped with yellow mustard,...",33165
Arbetter's Hot Dogs,"Nostalgia in a bun. It seems nothing has changed here since I first came, probably 20 years ago, and I wouldn't have it any other way. In the full glory of...",33165
Atelier Monnier - Brickell Cafe,"Have been here twice already, and have got to say: they have the best sandwiches in Miami. WOW. 

The restaurant is more of a bakery kind of place, but they...",33131
Atelier Monnier - Brickell Cafe,"Very good.  Everything looked good.  Had water waiting at the door, French toast...very good.  Avocado pancetta crepes...also very good.  Breads look...",33131
Atelier Monnier - Brickell Cafe,"Their lunch menu is amazing, I have lunch their almost every day and it feels so Homey and of course with that French savoir faire 
It's just amazing!!!...",33131
Jamrock Cuisine,"I went there for the 3rd time. I thoroughly enjoyed their jerk loaf deluxe. 
I will be trying the Jamaican Chinese dishes they have on the menu.  
I had...",33186
Jamrock Cuisine,"I stopped by yesterday and chatted with the owner, Marcia (pronounced mar-si-ya).  She is a warm and lovely lady and with a take out menu in hand, told her...",33186
Jamrock Cuisine,Best patties in kendall.  Best Jamaican food in town.   Jerk chicken is amazing and all plates are to die for,33186
Subs 88,"TLDR - ""I just had a sandwich, no ordinary sandwich!"" -That one fish in Spongebob 

Miami's got no shortage of 5-Star restaurants or artisanal dessert shops...",33176
Subs 88,"Open till 8:00pm? More like open whenever it's convenient for them. At about 2:45pm I walk up to the restaurant and noticed there was a ""closed"" sign on the...",33176
Subs 88,"I came here twice and loved it each time. First, the subs and sandwiches are huge, easily two meals. Everything is grilled and cooked well. You really don't...",33176
Casola's Pizzeria & Sub Shop,This is a Miami staple. Open late on the weekends. Cash only!! They have an ATM inside that charges a fee. Seating inside as well as in front of the...,33145
Casola's Pizzeria & Sub Shop,"For years this has been the go to place after a day at the beach, late night of drinking, or when you just want some satisfying late night carbs. 

Stopped...",33145
Casola's Pizzeria & Sub Shop,"I had the cheese pizza and the veggie pizza. The cheese pizza was short from spectacular, it was ok. I've had better in Miami.  If you order cheese pizza...",33145
Ms. Cheezious,I decided to try this food truck at a canvas event and was not disappointed. Tried the bbq pulled pork and it was excellent. The sharp cheddar was dripping...,33138
Ms. Cheezious,Ordered their chicken wings and mac and cheese sandwich and wasn't blown away by the taste. Also thier pastelito shake which was good. Those 3 things ran...,33138
Ms. Cheezious,"My friend and I were at the truck for a while deciding which sandwich to share and never got asked if we needed help/recommendations, or any notification...",33138
Madrid Tapas Y Vinos,"The local feel of Madrid

Great service team.... Enmanuel our waiter that night is simply ""top shelf!!""

Gluten free is understood and plenty of 'local...",33126
Madrid Tapas Y Vinos,"Unsafe for anyone with any food allergies!!! They also don't take allergies seriously and are super dismissive of them
I have a gluten and dairy allergy....",33126
Madrid Tapas Y Vinos,"I have driven by this place everyday on my way to work and have never stopped in. I was starving a decided i would give it a try. 

The restaurant is small...",33126
1-800-Lucky,"I absolutely love the concept of this place. I went on a Saturday afternoon and it was a little crowded. The actual food places where fast enough, the only...",33127
1-800-Lucky,"Nice place if you go with a group
You should definitely try the brisket banh mi, the fried rice or the ramen
There is no Asahi beer even if they have a big...",33127
1-800-Lucky,This place was awesome. I have only been once and can't wait to go again. I love the concept of the food and ordering. There is about 5 different...,33127
Ella's Oyster Bar,Really like the crab croquettes. All was good. Not much of an appetite as I'm going through a hard time right now. But the food here is really good just as...,33135
Ella's Oyster Bar,"Super good spot!!! quiet for lunch but it was a Tuesday.
Ordered the following:

Crab Croqueta, by far the best thing on the menu. Filled with crab on top...",33135
Ella's Oyster Bar,"Well I was absolutely surprised how Little Havana has changed and making a strong comeback. 
Convinced my hubby to do something a little out of our normal...",33135
Town Kitchen & Bar,"As someone who frequents the South Miami area for the food and nightlife, Town Kitchen & Bar has become one of my favorite restaurants. 

It feels like...",33143
Town Kitchen & Bar,Had been there once a year ago for a brunch and liked it. Went a few months later for dinner and enjoyed it too. Decided to take some coworkers to brunch on...,33143
Town Kitchen & Bar,This was my second time at Town. The first time we came was on a Groupon. Our server was Maxx and the manager that night was Nick. I had a great experience...,33143
Joanna's Marketplace,"TLDR - In the words of Stefon from SNL, ""this place has everything.""

This local market and deli is something every neighborhood in Miami needs. They got...",33143
Joanna's Marketplace,Been coming to Joannas for years and had them cater for us a few times. Everyone there is always so kind and helpful but i recently had a very unpleasant...,33143
Joanna's Marketplace,"My first microwaved Cuban Sandwich
At Joanna's
Disgusting , you never microwave sandwiches especially a Cuban in Miami
Will never be back",33143
Tacos El Carnal,"Ummmmm wow this place is awesome! Came here after a long days work. I was hungry, tired, barely able to muster up the energy to walk through the door. But I...",33135
Tacos El Carnal,"So me and my partner come here sometimes, when nothing else is open.. and never had a problem until today, we ordered an horchata and a fly fell in it ! And...",33135
Tacos El Carnal,"The food is good but it's a shame that the wait staff is so rude. Our waitress looked miserable while taking our order, got it wrong, then made it seem as...",33135
Ariete,"This restaurant was amazing! I went here a few months ago and was blown away. We sat inside and the ambience was great. 

Parking was a little complicated....",33133
Ariete,"Drinks to die for, yuca beignets a la huancaina  .... tile fish  amaizing ....
Great ambience....
Plenty of parking spots... staff was super friendly 
You...",33133
Ariete,"This restaurant is fast becoming my favorite in the Grove for a special occasion dinner.  The atmosphere is cozy, featuring an open kitchen which adds to...",33133
Asian Thai Kitchen,"Asian Thai Kitchen is the definition of a place I would have never discovered without Yelp. Why you ask? It is in a Kwik Stop. 

Would I ever expect amazing...",33133
Asian Thai Kitchen,Amazing thai food.  This is heavy rotation for take out dinners.  The crispy duck curry is scrumptious!  Good ceviche too.,33133
Asian Thai Kitchen,"The first time I walked into the convenience store off of Grand Avenue in Coconut Grove, I was a little put off by the fact that they were serving hot asian...",33133
Barley An American Brasserie,"Croquetas, and Cauliflower and Octopus oh my! Lol, let me start off by saying, this food was so delicious! I had dinner here last night with friends, and it...",33156
Barley An American Brasserie,"Barley an American Brassiere offers a schizophrenic menu. According to my server ""its fusion.""  No, brassiere means a restaurant that serves small casual...",33156
Barley An American Brasserie,"Went there tonight and it was awesome. Mauro was our server and he was absolutely great. 

It's all about the small details, I asked him if a type of beer...",33156
Atlas Meat-Free Delicatessen,Atlas is a lifesaver. Their portions are how it should be - big. Their food is delicious. And they're not too far from home. I wish they'd be open until...,33138
Atlas Meat-Free Delicatessen,"Yo Atlas, THANK YOU FOR SAVING US!!

If you're in the mood for some comfort food that isn't a bowl, burrito or some sorry excuse that ""gets the job done""...",33138
Atlas Meat-Free Delicatessen,SUPERB!!!! That's all I have to say about Atlas. I was shooketh of how flavorful a lot of the food were since it's vegan. The cheese sauce is so good!! I...,33138
Via Verdi Miami,"Great food. Amazing service. Best waiter We have had in many years. Gergo from Hungary.

The food is traditional italian. Great menu and great selection of...",33138
Via Verdi Miami,"I love Italian food but it always happens to me that when I want to go out and have an amazing pasta, I find myself confused and frustrated because I still...",33138
Via Verdi Miami,"The food was great! It all seemed very authentic to me. The mushroom pasta was a bit salty, but still very good. I also really liked the bread, which was...",33138
Talavera Cocina Mexicana,"Love love love Talavera.  Great date night place,  great seating in the outside area after they have finished all of the construction. Great for people...",33134
Talavera Cocina Mexicana,Today I headed to Talavera an outpost of the Jaguar Group (jaguar restaurant and peacock in the grove) in the Gables.  First the table was set for only 1....,33134
Talavera Cocina Mexicana,"The service was awful. The waitress came 2 times during a full 50 minutes dinner, the drinks took more than 20 minutes to be in our table and it was only...",33134
Latin Cafe 2000,"Not sure why this place doesn't get more good reviews. 

It's not pretty but it's not a dive either. 

It's also very reasonable for what you get 

I had...",33126
Latin Cafe 2000,"Have you ever been treated so poorly and discriminated against at a restaurant that you felt sick?  Well, I did.

This is one of the hardest reviews I've...",33126
Latin Cafe 2000,"As I was heading to my hotel I realized that Latin Café 2000 had an awesome walk up window.

I stopped by the next morning and there were a few people in...",33126
Piola,What I like about the pizza scene in Miami is that they're almost always successful restaurants that  open up somewhere else in the states and some genius...,33130
Piola,"This an update review: I don't like to give bad reviews but !!! I need to tell the truth. 
This place changed, it was good but not anymore.
Table are dirty...",33130
Piola,"Sometimes I'm attracted to a restaurant because of the art that adorns it's walls. 

I was drawn in by the mischievous spray-painted mural of a woman that...",33130
GK Bistronomie,"Ceviche was so delicious!
Bright bold flavors.

Parking tricky but that's the whole wynwood are. Bartender was good and the pork taquitos were spicy and...",33127
GK Bistronomie,"They have a good happy house everyday from 4-7:30 pm where they have $5 cocktails, appetizers ranging from $4-$7, and basic sushi rolls with 6pcs for $5....",33127
GK Bistronomie,"1st time going here. We have been trying to find a good happy hour spot and their menu looked great! Happy hour til 7:30, $5 wines and cocktails, $3 beers,...",33127
Caffe Vialetto,"Cafe Vialetto never disappoints. 
I've been coming here for years and is very consistent with quality food and good service. Portions are big and prices are...",33146
Caffe Vialetto,"I understand why this place has such good ratings! It was absolutely delicious. 

My boyfriend and I decided to celebrate our anniversary here and I am glad...",33146
Caffe Vialetto,"I discovered this gem when my son started at the U in 2014. Tucked away in Coral Gables, it is a charming spot with great ambiance, food and service. The...",33146
Hole In The Wall,"Hellooooo pulled pork! Best pulled pork I've ever had (I prefer it even over North Carolina style pulled pork)! Every time I come, I'm craving the pulled...",33186
Hole In The Wall,This was my first time coming here and i enjoyed the sandwich I ordered. I went with the house bbq brisket sandwich with a side of fries. The sandwich has a...,33186
Hole In The Wall,"Service, horrible.
Wings, not good.
Ribs, amazing.

When we got there we stood by the door waiting to be seated (it was our first time) for about 5 minutes....",33186
The Sushi Bar,I just had to come back and update my review for The Sushi Bar as I hadn't been in probably over 8-9 months (after visiting routinely every few weeks) and...,33173
The Sushi Bar,This restaurant is literally a sushi bar.  It is tiny!  I think there are only two tables which seat only two people so you will probably have to sit at the...,33173
The Sushi Bar,"This place hasn't disappointed since I've discovered it, thanks to my wife. The service is always great, regardless of how busy they are, the sushi chef...",33173
House of Wings,House of Wings is Legit!!!  I drove by this place a few times over the years but never went in.  Today SuperBowl Sunday I said let's give it a shot....,33136
House of Wings,"Preferred the honey barbecue and the honey garlic sauce wings with French fried and they were delicious. 

They had so many different flavors I didn't know...",33136
House of Wings,"TLDR - I might like their Barack Obama even more than the actual Barack Obama

These are going to be some of the best wings you find in Miami. I've only...",33136
Harry's Pizzeria - Coconut Grove,"Dining tonight at Harry's pizza in the grove! 
Fabulous experience, our server Damaris, fantastic, ask for her, you will get GREAT service! 
Very fresh...",33133
Harry's Pizzeria - Coconut Grove,"Average food, terrible service.

We were told if sitting outside to sit anywhere, so we did. After a while of sitting and no one showing up I had to...",33133
Harry's Pizzeria - Coconut Grove,"Excited about #YelpRestaurantWeek and its long list of restaurants offering event discounts, I selected Harry's as a ""must do"".  

Stopped in for a mid week...",33133
100 Montaditos,I have always loved 100 Montaditos. This location is the closest to me & it's 35 minutes away. But it most definitely is worth the drive here for the food....,33127
100 Montaditos,"100 Montaditos is always a good choice either for snacking or as a meal. 
The location is great. 
The staff was a little out of it, maybe because I got...",33127
100 Montaditos,"This fast casual chain offers a variety of Spanish Tapas, most notably their mini sandwiches. When I first thought of  mini sandwiches, I thought ""boring!""...",33127
Pincho Factory,"I got the Latin rice bowl $8.99 and I thought it was soo delicious! My chicken was cooked to perfection, wasn't dry at all, my rice was perfectly cooked as...",33134
Pincho Factory,It's a shame when a neighborhood restaurant starts to go downhill. I've been eating at this Pincho Factory since my office moved to the neighborhood in...,33134
Pincho Factory,"Great atmosphere, very friendly staff. Pincho Burger was cooked just as I requested. Very filling.
Hot dogs are all beef which is a plus the Frescno Dog was...",33134
Atlantis Cafe,"Wow, what a find!

Came here for breakfast with the family while on a trip to Miami. We were trying to decide whether to eat free hotel breakfast (blegh) or...",33128
Atlantis Cafe,Wow this place was amazing. Decided to try it while browsing through Yelp while staying down town and will definitely be coming back every time I'm in the...,33128
Atlantis Cafe,"Truly wonderful experience during a quick jury duty lunch! I ordered the Big Gus (bacon, chicken, produce, I believe) and the #5 smoothie. From the service,...",33128
Naomi's Garden Restaurant & Lounge,"My girls and I visited Naomi's during our trip to Miami. I felt the love in that food, wow. Living in Boston, you do not get quality food like this in...",33150
Naomi's Garden Restaurant & Lounge,"TLDR - !!! De' Naomi (read backwards) 

Man I hope nobody's made that joke yet. But forreal tho, I definitely did from bite number 1 all the way to the last...",33150
Naomi's Garden Restaurant & Lounge,"Ordered from Naomi's for take out for Christmas Eve dinner with my family. I ordered the macaroni, rice, stew chicken, sweet plantain and fried plantain....",33150
Spice N Curry,What a great find! Their lunch special is amazing & i love their chicken curry and naan. I'm usually not a fan of indian food since a lot of places i've...,33174
Spice N Curry,"Spice 'N Curry offers a unique aspect that many others can't -- it's both a grocery store  AND a cafe/diner setup. You walk into the grocery store, all the...",33174
Spice N Curry,"This place is a small market with an even smaller area where they serve you some very delicious food. We ordered the Chicken Korma ( chicken curry), which...",33174
Giardino Gourmet Salads,The first time I ever ordered from here I wasn't crazy about it because of my own fault. I ordered a salad with capers and I really don't like...,33176
Giardino Gourmet Salads,There's nothing I hate more than wilted slimy lettuce with brown spots.  So disappointed and disgusted I didn't even eat it.  A $10 salad that's not even...,33176
Giardino Gourmet Salads,Giardino's is my go-to salad spot! They have a variety of salads to satisfy all taste buds! I personally like creating my own salad because I mix salty and...,33176
Moshi Moshi,"When you want fast but GOOD quality sushi, Moshi Moshi is the place. There are various locations all throughout Miami and best of all they are open pretty...",33138
Moshi Moshi,"A while ago we went to Moshi Moshi and had a terrible experience. However, we decided to give them another chance and have been super hooked in the past 3...",33138
Moshi Moshi,Moshi Moshi was referred to me by a Lyft driver with a Mercedes. Myself and Fabiola are both sushi-lovers and have been dozens of places in Miami for both...,33138
Dogma Grill,"We are in town for vacation and one of us wanted a hot dog place.  Looking in Yelp I found this place, and trusting the reviews we decided to try it.  I'm...",33138
Dogma Grill,"The owners change. The menu changes. The classic hot dogs are still the same. And, predictably good! 
After many years, still my go-to when craving a...",33138
Dogma Grill,"Stopped into Dogma Grill for lunch on Thursday afternoon. Ordered the Chicago Dog and the Atlanta Dog.

Quality
Dogma Grill is much more than just a...",33138
Enriqueta's Sandwich Shop,"This place was the best cuban sandwich I have ever had! To be fair though, I had only had outside of Miami.

Loved the diner vibe and interior, and the...",33137
Enriqueta's Sandwich Shop,"Cheap fast and as Miami as it can get. You would expect a spot like this Little Havana. Instead it is surviving in an area that is all new shops, fancy high...",33137
Enriqueta's Sandwich Shop,"I am sad to notice I had apparently never reviewed this bastion of Cuban awesomeness. But, today, we find ourselves here enjoying the most amazing Cuban...",33137
Shokudo,"This is my go to places if I want really good Asian sorbet dessert.

 I came here initially intend to try the ramen noodle, as I still struggle to find...",33137
Shokudo,This hidden gem is really something else. Located on 2nd ave close to design district but not too close...all I have to say is wow. The restaurant is...,33137
Shokudo,Happy hour goes til 7:30 and was great. Really good drinks and awesome sushi. The spicy tuna roll and chipotle salmon bomb were excellent as were the drinks...,33137
Gyroville,"I love this Gyroville! I like coming here sometimes with my family, as they have great falafel gyros and salads. The display is much like Chipotle's...",33176
Gyroville,"Last time I passed by here at 8pm, an hour before closing and I walked right back out because of the faces I had gotten. And don't get me wrong, I get it,...",33176
Gyroville,"The only reason why I'm giving you one star is because that's the only way I can tell you what happened. 

It's Monday,  February 26th at 7:00 p.m. My...",33176
Jimmy's Eastside Diner,We stumbled upon Jimmys on accident after leaving church and we couldn't have been more surprised! We saw that it looked like a small cozy diner and when we...,33138
Jimmy's Eastside Diner,"The '70's called... they want their diner back!

Since I hail from New Jersey, my diner bar is high and Jimmy's cleared it and then some! I'm ashamed to...",33138
Jimmy's Eastside Diner,"Had breakfast at Jimmy's Eastside Diner on Sunday morning. Ordered Two Over Easy Eggs with Rye Toast, N.Y. Style Corned Beef Hash, and Hash Brown Potatoes,...",33138
Havana Harry's,"Nothing less than 5 Stars - this place is awesome! The wait time was 45 mins which wasn't ideal but hey totally worth it!

The menu has such great variety,...",33146
Havana Harry's,I held off rating this place until I could eat there several times.  The first time I was super impressed because the cafe con leche was the best I've had...,33146
Havana Harry's,"Very glad that a friend recommended this place! 

I like that this is a restaurant that also serves tons of desserts! I mainly just got their cuban...",33146
Lo de Lea,"This was my first visit, at first I was taken a back by the size of the place....very small. The management were very nice and friendly. As far as the...",33138
Lo de Lea,"I've enjoyed plenty of wonderful meals here-- both by dining in and ordering to go-- but tonight was not one of them.

Spoiler Alert: Overcharged and...",33138
Lo de Lea,"The best Argentinian restaurant in miami hands down. So authentic, so cozy, great service and worth every penny! I cannot rave about it enough. Luckily I...",33138
Aoki Teppanyaki,"Since this restaurant models Kevin Aoki's fathers, Benihana, it should definitely live up to the same standards or maybe even excel over them. 

We took the...",33156
Aoki Teppanyaki,Food is always good here! I've been coming to eat to all of the restaurants in Miami that Kevin owns and I have to say that the consistency is excellent!...,33156
Aoki Teppanyaki,"Extremely disappointed and offended by the general manager at @Aoki.

I am not the kind of person who likes to post long reviews about any negative...",33156
Killian Cafe & Grill,"Little gem in Kendall!! Service was great and lightning fast. Food was delicious, with giant hearty portions. And the vibe was very casual. 

Hubby and I...",33186
Killian Cafe & Grill,"I was very excited to come here and although the food wasn't disappointing, It was very packed which I guess there, lead to our service being horrible. She...",33186
Killian Cafe & Grill,I needed a new restaurant that has breakfast pass 1030am so finding this place I was pretty surprise because I've seen the place around but didn't think...,33186
Lulu,"One of my absolute favorite spots in Coconut Grove! The food quality, service, and atmosphere at Lulu are consistently 5 stars.

I can't believe it has...",33133
Lulu,"If you're looking for a Grove brunch experience this is probably the best next option after Berries in the Grove. 

They have a tight space inside, but if...",33133
Lulu,"Food was not worth the money. Service was good. 

Spinach artichoke dip was good but no better than any chain restaurant you can go to. 

Bacon wrapped...",33133
Breadman Miami,"Another Cuban bakery in Miami, really? My wife had been wanting to try this place because of Yelp.
Well, we had the usual, cafe con leche, and ham...",33144
Breadman Miami,"After telling the lady 5 times no mayonnaise, and her telling me that they don't put mayonnaise on pan con bistec.... guess what???  When I get back to my...",33144
Breadman Miami,"Great spanish bakery with a wide variety of cakes, pastries and sandwiches. Cant really ask for better service with great pricing in a clean environment....",33144
Station 28,"This place has the best burgers in downtown I love the crunchy grouper...lots of beers on tap 

Strongly recommend this place awesome.
Every Friday I'm here...",33131
Station 28,"This place is a cool outdoor venue in downtown and they look like they have nice happy hour deals.

This time we were just ordering takeout. The food was...",33131
Station 28,We decided to come here after work to have a beer and a  I've been to this burger joint twice before and was never super impressed but the things i...,33131
Yard House,"I'm a visitor to Miami and was taken here by my friend and host, who loves the restaurant and comes often. We sat outside, where the ambiance was lovely,...",33146
Yard House,"The Bottom Line: A lively restaurant with a multitude of beers and a strong ""American"" menu, this is a great place to get together with friends.

Try:
Sweet...",33146
Yard House,Decided to try Yard House (which I had heard varying opinions of) on a Monday for their happy hour specials. Their happy hour includes drinks and half off...,33146
SHOTS Miami,Last night I attended the valentines beer crawl and we started at Shots. I had never been to shots and the amount of drinks on their menu is honestly a...,33127
SHOTS Miami,This place always seems a bit dead whenever we go on Friday or Saturday nights. It is huge with most people hanging out in the outdoor area. Music is...,33127
SHOTS Miami,"First time coming here and I had a blast. It is 21 and up and the drinks are pretty good. 
I ordered a tequila sunrise and the bartender was not at all...",33127
Luke's Lobster Brickell City Centre,"Lobster is one of my favorite food groups and there is never a bad time to go into a happy lobster induced food coma. 

You can't go wrong with any of the...",33130
Luke's Lobster Brickell City Centre,I visited this place countless of times when it first opened. I love crab so I consistently ordered the crab roll every time I came here. Ive probably been...,33130
